{
  "$schema": "https://json-schema.org/draft/2020-12/schema",
  "type": "object",
  "properties": {
    "$schema": {
      "type": "string"
    },
    "version": {
      "type": "number",
      "const": 1
    },
    "groups": {
      "type": "object",
      "propertyNames": {
        "type": "string",
        "pattern": "^[a-z0-9][a-z0-9_-]*$"
      },
      "additionalProperties": {
        "type": "object",
        "properties": {
          "description": {
            "type": "string"
          },
          "owner": {
            "type": "string"
          },
          "old": {
            "minItems": 1,
            "type": "array",
            "items": {
              "type": "string",
              "pattern": "^(?:@[a-z0-9-*~][a-z0-9-*._~]*\\/)?[a-z0-9-~][a-z0-9-._~]*$"
            }
          },
          "new": {
            "default": [],
            "type": "array",
            "items": {
              "type": "string",
              "pattern": "^(?:@[a-z0-9-*~][a-z0-9-*._~]*\\/)?[a-z0-9-~][a-z0-9-._~]*$"
            }
          },
          "enforcement": {
            "default": {
              "mode": "report",
              "scope": "imports",
              "severity": "error"
            },
            "type": "object",
            "properties": {
              "mode": {
                "default": "report",
                "type": "string",
                "enum": [
                  "report",
                  "ratchet",
                  "ban"
                ]
              },
              "scope": {
                "default": "imports",
                "type": "string",
                "const": "imports"
              },
              "severity": {
                "default": "error",
                "type": "string",
                "enum": [
                  "error",
                  "warn"
                ]
              }
            },
            "additionalProperties": false
          },
          "docs": {
            "type": "string",
            "format": "uri"
          },
          "start": {
            "type": "integer",
            "minimum": 0,
            "maximum": 9007199254740991
          }
        },
        "required": [
          "old"
        ],
        "additionalProperties": false
      },
      "minProperties": 1
    },
    "ignore": {
      "type": "array",
      "items": {
        "type": "string",
        "minLength": 1
      }
    },
    "exceptions": {
      "type": "array",
      "items": {
        "type": "object",
        "properties": {
          "groupId": {
            "type": "string"
          },
          "files": {
            "minItems": 1,
            "type": "array",
            "items": {
              "type": "string",
              "minLength": 1
            }
          },
          "reason": {
            "type": "string",
            "minLength": 1
          },
          "owner": {
            "type": "string",
            "minLength": 1
          },
          "issue": {
            "type": "string"
          },
          "expires": {
            "type": "string",
            "pattern": "^\\d{4}-\\d{2}-\\d{2}$"
          }
        },
        "required": [
          "groupId",
          "files",
          "reason",
          "owner",
          "expires"
        ],
        "additionalProperties": false
      }
    }
  },
  "required": [
    "version",
    "groups"
  ],
  "additionalProperties": false,
  "title": "legacy-ratchet configuration (legacy.json)",
  "description": "Declares deprecated (\"old\") packages, their preferred replacements, and how new import sites are enforced."
}
